Component Name,Normalized Name,Nanotek Price,Nanotek Status,Nanotek URL
WANBO PROJECTOR BAG FOR X5/X5 PRO,wanboprojectorbagforx5x5pro,5000.0,Out of Stock,https://www.nanotek.lk/product/wanbo-projector-bag-for-x5x5-pro
Wanbo Mini Pro LCD HD Projector with Android 9.0,wanbominiprolcdhdprojectorandroid90,30000.0,Out of Stock,https://www.nanotek.lk/product/wanbo-mini-pro-lcd-hd-projector-with-android-90
Wanbo T2 Ultra Gimbal projector with Android TV 11,wanbot2ultragimbalprojectorandroidtv11,60000.0,In Stock,https://www.nanotek.lk/product/wanbo-t2-ultra-gimbal-projector-with-android-tv-11
Wanbo X5 Pro Android Smart Projector,wanbox5proandroidsmartprojector,75000.0,In Stock,https://www.nanotek.lk/product/wanbo-x5-pro-android-smart-projector
Wanbo Projector Floor Stand Pro,wanboprojectorfloorstandpro,15000.0,In Stock,https://www.nanotek.lk/product/wanbo-projector-floor-stand-pro
Wanbo X5 FHD AUTO FOCUS SMART ANDROID PROJECTOR,wanbox5fhdautofocussmartandroidprojector,65000.0,Out of Stock,https://www.nanotek.lk/product/wanbo-x5-fhd-auto-focus-smart-android-projector
Wanbo Outdoor Folding Screen Curtain (100-Inch),wanbooutdoorfoldingscreencurtain,20000.0,In stock,https://www.nanotek.lk/product/wanbo-outdoor-folding-screen-curtain-100-inch
Wanbo X2 Max Fully Automatic Android 1080P Smart Projector,wanbox2maxfullyautomaticandroid1080psmartprojector,44000.0,Out of Stock,https://www.nanotek.lk/product/wanbo-x2-max-fully-automatic-android-1080p-smart-projector
Wanbo HD Anti-Light Portable Curtain Pro,wanbohdantilightportablecurtainpro,7000.0,In Stock,https://www.nanotek.lk/product/wanbo-hd-anti-light-portable-curtain-pro
WANBO T2 Max FHD Portable MINI Projector,wanbot2maxfhdportableminiprojector,40000.0,Out of Stock,https://www.nanotek.lk/product/wanbo-t2-max-fhd-portable-mini-projector
WANBO T6 Max Auto Focus SMART FHD Projector - Intl. Version,wanbot6maxautofocussmartfhdprojectorintlversion,60000.0,Out of Stock,https://www.nanotek.lk/product/wanbo-t6-max-auto-focus-smart-fhd-projector-intl-version
Wanbo DaVinci 1 Pro 1080p Smart Android Projector,wanbodavinci1pro1080psmartandroidprojector,90000.0,In Stock,https://www.nanotek.lk/product/wanbo-davinci-1-pro-1080p-smart-android-projector
Wanbo T4 Auto Focus Full HD Smart Projector,wanbot4autofocusfullhdsmartprojector,45000.0,Out of Stock,https://www.nanotek.lk/product/wanbo-t4-auto-focus-full-hd-smart-projector
Wanbo Projector Floor Stand,wanboprojectorfloorstand,7000.0,Out of Stock,https://www.nanotek.lk/product/wanbo-projector-floor-stand
Wanbo EVA Capsule Galaxy Light | Backlight for Ambient Lighting for Room,wanboevacapsulegalaxylightbacklightforambientlightingforroom,16000.0,Out of Stock,https://www.nanotek.lk/product/wanbo-eva-capsule-galaxy-light-backlight-for-ambient-lighting-for-room
ACER X1226AH DLP PROJECTOR 4000 LUMENS,acerx1226ahdlpprojector4000lumens,146000.0,In Stock,https://www.nanotek.lk/product/acer-x1226ah-dlp-projector-4000-lumens
